Attribute,Description,Valid Values,DependsOn,Required,Source,Parent,Properties,DependsOn Component,Validation Rules,.ID,.Type,.Module,.Root,.SubOf,.Range,.Cardinality,.EditorNote
genomicsAssayTemplateNormalized,"Generic template for describing raw data from a genomic type assay (RNA-seq, Exome-seq, etc) WITHOUT full individual and biospecimen data. To link individual and biospecimen metadata, an additional “biospecimenTemplate_Default” must be additionally completed with either specimenID or aliquotID available for joining. This is a two-step template.",,"Component,Filename,resourceType,progressReportNumber,dataType,assay,platform,specimenID,aliquotID,runType,libraryPrep,comments",TRUE,Sage Bionetworks,template,,,,Genomics_Assay_Template_Normalized,Class,Template,Template,Assay_Template,,,
genomicsAssayTemplate,"Generic denormalized template for describing raw data from a genomic type assay (RNA-seq, Exome-seq, etc) along with individual, biospecimen and experimental metadata. This is a one-step template.",,"Component,Filename,resourceType,progressReportNumber,dataType,assay,platform,individualID,parentSpecimenID,isXenograft,runType,libraryPrep,comments",TRUE,Sage Bionetworks,template,,,,Genomics_Assay_Template,Class,Template,Template,Assay_Template,,,
genomicsAssayTemplateExtended,"Template for describing raw data from a genomic type assay (RNA-seq, Exome-seq, etc) with extended properties for capturing additional metadata such as gene perturbation parameters or experimental conditions and time points. This is a one-step template.",,"Component,Filename,resourceType,progressReportNumber,dataType,assay,platform,individualID,parentSpecimenID,isXenograft,experimentalCondition,experimentalTimepoint,runType,libraryPrep,genePerturbed,comments",TRUE,Sage Bionetworks,template,,,,Genomics_Assay_Template_Extended,Class,Template,Template,Assay_Template,,,
WGSTemplate,"Template for describing raw data from Whole Genome Sequencing (WGS)",,"Component,Filename,resourceType,progressReportNumber,dataType,assay,platform,individualID,parentSpecimenID,runType,libraryPrep,comments",TRUE,Sage Bionetworks,template,,,,WGS_Template,Class,Template,Template,Assay_Template,,,
WESTemplate,"Template for describing raw data from Whole Exome Sequencing (WES)",,"Component,Filename,resourceType,progressReportNumber,dataType,assay,platform,individualID,parentSpecimenID,runType,targetCaptureKitID,libraryPrep,comments",TRUE,Sage Bionetworks,template,,,,WES_Template,Class,Template,Template,Assay_Template,,,
RNASeqTemplate,"Template for describing raw data from (bulk) RNA-sequencing",,"Component,Filename,resourceType,progressReportNumber,dataType,assay,platform,individualID,parentSpecimenID,runType,libraryPrep,targetDepth,comments",TRUE,Sage Bionetworks,template,,,,RNA_Seq_Template,Class,Template,Template,Assay_Template,,,
ScRNASeqTemplate,"Template for describing raw data from single-cell RNA-sequencing (scRNA-seq)",,"Component,Filename,resourceType,progressReportNumber,dataType,assay,platform,individualID,parentSpecimenID,isXenograft,runType,libraryPrep,comments",TRUE,Sage Bionetworks,template,,,,ScRNA_Seq_Template,Class,Template,Template,Assay_Template,,,
ProcessedAlignedReadsTemplate,"Template for describing aligned reads output data (i.e. BAM)",,"Component,Filename,resourceType,progressReportNumber,dataType,assay,platform,individualID,parentSpecimenID,averageInsertSize,averageReadLength,averageBaseQuality,pairsOnDifferentChr,readsDuplicatedPercent,readsMappedPercent,meanCoverage,proportionCoverage10x,proportionCoverage30x,readDepth,totalReads,workflow,genomicReference,comments",TRUE,Sage Bionetworks,template,,,,Processed_Aligned_Reads_Template,Class,Template,Template,Assay_Template,,,
ProcessedVariantCallsTemplate,"Template for describing either germline or variant calls output data (i.e. VCF/MAF)",,"Component,Filename,resourceType,progressReportNumber,specimenID,dataType,assay,individualID,isFilteredReads,workflow,comments",TRUE,Sage Bionetworks,template,,,,Processed_Variant_Calls_Template,Class,Template,Template,Assay_Template,,,
ProcessedExpressionTemplate,"Template for describing expression output data",,"Component,Filename,resourceType,progressReportNumber,dataType,assay,individualID,specimenID,parentSpecimenID,modelSystemName,workflow,expressionUnit,comments",TRUE,Sage Bionetworks,template,,,,Processed_Expression_Template,Class,Template,Template,Assay_Template,,,
imagingAssayTemplate,"Generic template for describing data from an imaging type assay (IHC, etc). This is a one-step template.",,"Component,Filename,resourceType,progressReportNumber,dataType,assay,platform,assayTarget,individualID,parentSpecimenID,comments",TRUE,Sage Bionetworks,template,,,,Imaging_Assay_Template,Class,Template,Template,Assay_Template,,,
imagingAssayTemplateExtended,"Template for describing data from an imaging type assay (IHC, etc) with extended properties for capturing additional metadata such as gene perturbation parameters or experimental conditions and time points. This is a one-step template.",,"Component,Filename,resourceType,progressReportNumber,dataType,assay,platform,assayTarget,individualID,parentSpecimenID,experimentalCondition,experimentalTimepoint,genePerturbed,comments",TRUE,Sage Bionetworks,template,,,,Imaging_Assay_Template_Extended,Class,Template,Template,Assay_Template,,,
MRIAssayTemplate,Generic template for describing data from an MRI assay. This is a one-step template.,,"Component,Filename,resourceType,progressReportNumber,dataType,assay,platform,individualID,parentSpecimenID,experimentalCondition,experimentalTimepoint,MRISequence,comments",TRUE,Sage Bionetworks,template,,,,MRI_Assay_Template,Class,Template,Template,Assay_Template,,,
epigeneticsAssayTemplate,Generic template for describing data from an epigenetics assay. This is a one-step template.,,"Component,Filename,resourceType,progressReportNumber,dataType,assay,platform,individualID,parentSpecimenID,experimentalCondition,experimentalTimepoint,libraryPrep,comments",TRUE,Sage Bionetworks,template,,,,Epigenetics_Assay_Template,Class,Template,Template,Assay_Template,,,
pharmacokineticsAssayTemplate,Generic template for describing data from a pharmacokinetics assay. This is a one-step template.,,"Component,Filename,resourceType,progressReportNumber,dataType,assay,platform,assayTarget,individualID,parentSpecimenID,experimentalCondition,experimentalTimepoint,genePerturbed,comments",TRUE,Sage Bionetworks,template,,,,Pharmacokinetics_Assay_Template,Class,Template,Template,Assay_Template,,,
proteomicsAssayTemplate,Generic template for describing data from a proteomics assay. Note that specialized proteomics assays may have their own template to capture more detailed information. This is a one-step template.,,"Component,Filename,resourceType,progressReportNumber,dataType,assay,platform,individualID,parentSpecimenID,experimentalCondition,experimentalTimepoint,proteinExtractSource,comments ",TRUE,Sage Bionetworks,template,,,,Proteomics_Assay_Template,Class,Template,Template,Assay_Template,,,
plateBasedReporterAssayTemplate,Generic template for describing data from a plate-based reporter assay. This is a one-step template.,,"Component,Filename,resourceType,progressReportNumber,dataType,assay,platform,assayTarget,individualID,parentSpecimenID,experimentalCondition,experimentalTimepoint,reporterGene,reporterSubstance,comments",TRUE,Sage Bionetworks,template,,,,Plate_Based_Reporter_Assay_Template,Class,Template,Template,Assay_Template,,,
patientTimepointsTemplate,Template for capturing individual-level metadata with time points. Do not use for data file annotation.,,"Component,individualID,experimentalTimepoint",TRUE,Sage Bionetworks,template,,,,Patient_Timepoints_Template,Class,Template,Template,Non_Assay_Template,,,
clinicalAssayTemplate,"Annotation template for simple endpoint data from clinical assays often used in diagnostic practice or clinical trials; may include repeated measures and a treatment/intervention context. Examples include bloodwork results (creatine assay, serum antibody assay), tumor size measurements, or medication adherence. Note that clinical data are from human individuals, therefore species should be “human”.  ",,"Component,Filename,resourceType,progressReportNumber,dataType,assay,platform,individualID,parentSpecimenID,experimentalCondition,experimentalTimepoint,comments",TRUE,Sage Bionetworks,template,,,,Clinical_Assay_Template,Class,Template,Template,Assay_Template,,,
clinicalAssayTemplateExtended,Annotation template for simple endpoint data from clinical assays often used in diagnostic practice or clinical trials; may include repeated measures and a treatment/intervention context. Extended to capture additional drug/treatment parameters.,,"Component,Filename,resourceType,progressReportNumber,dataType,assay,platform,individualID,parentSpecimenID,experimentalCondition,experimentalTimepoint,compoundName,compoundDose,comments",TRUE,Sage Bionetworks,template,,,,Clinical_Assay_Template_Extended,Class,Template,Template,Assay_Template,,,
behavioralAssayTemplate,"Generic template for describing data from behavioral assays such as “adaptive n-back task” (for humans) or “shock-probe defensive burying test” (for mice). If another modality is used as part of the behavioral assay, e.g. fMRI, that data can be linked.",,"Component,Filename,resourceType,progressReportNumber,dataType,assay,platform,individualID,experimentalCondition,experimentalTimepoint,comments",TRUE,Sage Bionetworks,template,,,,Behavioral_Assay_Template,Class,Template,Template,Assay_Template,,,
sourceCodeTemplate,Template for describing scripts or source code files for a software application.,,"Component,Filename,resourceType,programmingLanguage,documentation,runtimePlatform,comments",TRUE,Sage Bionetworks,template,,,,Source_Code_Template,Class,Template,Template,Non_Assay_Template,,,
protocolTemplate,Template for describing a protocol document. (BETA) Adapted from https://bioschema.org/profiles/LabProtocol/0.6-DRAFT-2020_12_08,,"Component,Filename,resourceType,author,citation,license,comments",TRUE,Sage Bionetworks,template,,,,Protocol_Template,Class,Template,Template,Non_Assay_Template,,,
pdxGenomicsAssay,Template for describing PDX assay data that extends genomicsAssay.,,"Component,Filename,resourceType,progressReportNumber,dataType,assay,platform,individualID,parentSpecimenID,experimentalCondition,experimentalTimepoint,transplantationType,genePerturbed,runType,libraryPrep,comments",TRUE,Sage Bionetworks,template,,,,PDX_Genomics_Assay_Template,Class,Template,Template,Assay_Template,,,
updateMilestoneReport,Defines a metadata template for updating milestone report values in NF studies -- currently a supported feature for NTAP and GFF.,,"Component,Filename,resourceType,progressReportNumber",FALSE,Sage Bionetworks,template,,,,Update_Milestone_Report,Class,Template,Template,Non_Assay_Template,,,
template,Parent attribute for the manifest template attributes.,,,FALSE,Sage Bionetworks,template,,,,Template,Class,Template,Template,,,,
individualTemplate,Base template for minimal information describing individual-level data within the NF scope. Not called “patientTemplate_Default” because individuals can be a non-human organism.,"individualID,sex,age,ageUnit,species,diagnosis,nf1Genotype,nf2Genotype","Component,individualID,sex,age,ageUnit,species,diagnosis,nf1Genotype,nf2Genotype",FALSE,Sage Bionetworks,template,,,,Individual_Template,Class,Template,Template,Non_Assay_Template,,,
biospecimenTemplateNormalized,Base template for describing biospecimen-level data.,"parentSpecimenID,specimenID,aliquotID,organ,tissue,isCellLine,isPrimaryCell,cellType,tumorType,specimenPreparationMethod,modelSystemName","Component,parentSpecimenID,specimenID,aliquotID,organ,tissue,isCellLine,isPrimaryCell,cellType,tumorType,specimenPreparationMethod,modelSystemName",FALSE,Sage Bionetworks,template,,,,Biospecimen_Template_Normalized,Class,Template,Template,Non_Assay_Template,,,
biospecimenTemplate,Denormalized template for describing biospecimen data that includes all individual-level data as well.,,"Component,individualID,parentSpecimenID",FALSE,Sage Bionetworks,template,,,,Biospecimen_Template,Class,Template,Template,Non_Assay_Template,,,
dataFileComponent,Template component for describing a data file resource that extends fileTemplate_Default with required properties dataType and dataSubtype.,"Filename,entityId,fileFormat,resourceType,dataType,dataSubtype","Filename,entityId,fileFormat,resourceType,dataType,dataSubtype",FALSE,Sage Bionetworks,template,,,,Data_File_Component,Class,Template,TemplateComponent,,,,
experimentComponent,Template component for describing core experimental parameters.,"experimentalCondition,experimentalTimepoint","experimentalCondition,experimentalTimepoint",FALSE,Sage Bionetworks,template,,,,Experiment_Component,Class,Template,TemplateComponent,,,,
genePerturbComponent,Template component for adding genetic perturbation metadata. This applies only to some assays and does not make sense with e.g. behavioral assays.,"genePerturbed,genePerturbationType,genePerturbationTechnology","genePerturbed,genePerturbationType,genePerturbationTechnology",FALSE,Sage Bionetworks,template,,,,Gene_Perturb_Component,Class,Template,TemplateComponent,,,,
fileComponent,Template component for describing some file on the NF-OSI Synapse platform.,"Filename,entityId,fileFormat,resourceType","Filename,entityId,fileFormat,resourceType",FALSE,Sage Bionetworks,template,,,,File_Component,Class,Template,TemplateComponent,,,,
ngsComponent,Template component capturing Next Gen Sequencing/genomics attributes.,"runType,readPair,isStranded,readPairOrientation,readStrandOrigin,libraryPrep,libraryPreparationMethod,dissociationMethod,readLength,nucleicAcidSource","runType,readPair,isStranded,readPairOrientation,readStrandOrigin,libraryPrep,libraryPreparationMethod,dissociationMethod,readLength,nucleicAcidSource",FALSE,Sage Bionetworks,template,,,,NGS_Component,Class,Template,TemplateComponent,,,,
LightScatteringAssayTemplate,"Template for dynamic or static light scattering data adapted from ISA-TAB-Nano specs (https://wiki.nci.nih.gov/display/icr/isa-tab-nano)",,"Component,Filename,resourceType,dataType,assay,materialType,specimenID,pH,concentrationMaterial,concentrationMaterialUnit,concentrationNaCl,concentrationNaClUnit,comments",FALSE,Sage Bionetworks,template,,,,Light_Scattering_Assay_Template,Class,Template,Template,,,,
FlowCytometryTemplate,"Basic template for flow cytometry assay",,"Component,Filename,resourceType,dataType,assay,platform,individualID,specimenID,cellType,experimentalCondition,comments",FALSE,Sage Bionetworks,template,,,,FACS_Template,Class,Template,Template,,,,
