name,title,description,source_file,term_type,range,aliases,match_rank,match_type,match_score,rop_item,rop_description,rop_collection,rop_alternate_names,rop_source_authority,rop_item_type,rop_values,rop_priority,rop_source_file
ATAC-seq,ATAC-seq,Open chromatin regions measured by sequencing DNA after assay for transposase-accessible chromatin (ATAC) treatment,modules/Assay/Assay.yaml,enum_value:SequencingAssayEnum,,,,no_match,,,,,,,,,,
CAPP-seq,CAPP-seq,Cancer Personalized Profiling by deep sequencing (CAPP-seq) is a novel blood-based assay that uses next-generating sequencing to quantitate circulating tumor DNA (ctDNA),modules/Assay/Assay.yaml,enum_value:SequencingAssayEnum,,,,no_match,,,,,,,,,,
CUT&RUN,CUT&RUN,Cleavage Under Targets and Release Using Nuclease (CUT&RUN) is a chromatin profiling strategy in which antibody-targeted controlled cleavage by micrococcal nuclease releases specific protein-DNA complexes into the supernatant for paired-end DNA sequencing. (doi:10.7554/eLife.21856),modules/Assay/Assay.yaml,enum_value:SequencingAssayEnum,,,1,name_fuzzy,60.0,BatchID,"Cohort-scoped batch identifier for the assay run. Required for batch-effect correction in cross-cohort meta-analysis. Granularity is study-defined (sequencing run, plate, library prep batch) but must be consistent within a collection.",RoP-Core-Omics-Platform,Batch|RunBatch|AssayBatch,DataTecnica-derived,string,,Required-for-omics-data,06_omics.json
ChIP-seq,ChIP-seq,Chromatin immuno-precipitation followed by sequencing,modules/Assay/Assay.yaml,enum_value:SequencingAssayEnum,,,,no_match,,,,,,,,,,
ERR bisulfite sequencing,ERR bisulfite sequencing,Enhanced reduced representation bisulfite sequencing (ERRBS),modules/Assay/Assay.yaml,enum_value:SequencingAssayEnum,,,,no_match,,,,,,,,,,
HI-C,HI-C,Chromatin interactions detected by HI-C protocol,modules/Assay/Assay.yaml,enum_value:SequencingAssayEnum,,,,no_match,,,,,,,,,,
ISO-seq,ISO-seq,Full isoform sequencing,modules/Assay/Assay.yaml,enum_value:SequencingAssayEnum,,,1,name_fuzzy,60.0,VisitNumber,Sequential visit identifier within the study; 0 = baseline/screening visit.,RoP-Core-Time,VisitNum|VisitSeq|VisitIndex,DataTecnica-derived,numeric,0..200,Required-or-derivable,02_time.json
NOMe-seq,NOMe-seq,Nucleosome Occupancy and Methylome Sequencing,modules/Assay/Assay.yaml,enum_value:SequencingAssayEnum,,Nucleosome Occupancy and Methylome Sequencing,,no_match,,,,,,,,,,
RNA array,RNA array,RNA measurements captured by array technology,modules/Assay/Assay.yaml,enum_value:SequencingAssayEnum,,,,no_match,,,,,,,,,,
RNA-seq,RNA-seq,Bulk RNA sequencing,modules/Assay/Assay.yaml,enum_value:SequencingAssayEnum,,,1,name_fuzzy,60.0,VisitNumber,Sequential visit identifier within the study; 0 = baseline/screening visit.,RoP-Core-Time,VisitNum|VisitSeq|VisitIndex,DataTecnica-derived,numeric,0..200,Required-or-derivable,02_time.json
SNP array,SNP array,SNP measurements captured by array technology,modules/Assay/Assay.yaml,enum_value:SequencingAssayEnum,,,,no_match,,,,,,,,,,
SaferSeqS,SaferSeqS,A blood-based assay that evaluates mutations in circulating tumor DNA and chromosomal copy number changes to detect minimal residual disease (MRD) with high specificity towards tumor type.,modules/Assay/Assay.yaml,enum_value:SequencingAssayEnum,,,,no_match,,,,,,,,,,
Sanger sequencing,Sanger sequencing,"A DNA sequencing technique in which a mixture of deoxynucleosidetriphosphates (dNTPs) and chain-terminating dNTPs, which are radioactively or fluorescently labeled, are combined within the reaction mixture. Once the reaction is complete, the DNA strands are separated by size, and the labeled chain terminating dNTPs can be read in sequence by the investigator or by a machine.",modules/Assay/Assay.yaml,enum_value:SequencingAssayEnum,,Dideoxy Chain Termination DNA Sequencing,,no_match,,,,,,,,,,
T cell receptor repertoire sequencing,T cell receptor repertoire sequencing,A sequencing assay that determines the sequences of DNA or RNA molecules that encode the repertoire of T cell receptors within an input sample.,modules/Assay/Assay.yaml,enum_value:SequencingAssayEnum,,,,no_match,,,,,,,,,,
bisulfite sequencing,bisulfite sequencing,Methylation data captured by sequencing of DNA treated by a bisulfite-based chemical process,modules/Assay/Assay.yaml,enum_value:SequencingAssayEnum,,,,no_match,,,,,,,,,,
jumping library,jumping library,"Jumping libraries are created to bypass difficult to align/map regions, such as those containing repetitive DNA sequences. Briefly, the DNA of interest is identified, cut into fragments either with restriction enzymes or by shearing.  The size-selected fragments are ligated to adapters for bead-capture and circularized. After bead-capture, the DNA is linearized via restriction enzymes, and can be sequenced using adapter primers facing in outward [reverse/forward (RF)] directions.  These library inserts are considered jumping because the ends originate from distal genomic DNA sequences and are ligated adjacent to one another during circularization.",modules/Assay/Assay.yaml,enum_value:SequencingAssayEnum,,,1,name_fuzzy,63.6,KitChemistry,"Library prep, capture, or chemistry kit used. Free text capturing what was actually recorded. Examples: 'TruSeq Stranded mRNA', 'Single Cell 3' v3.1', 'Twist Comprehensive Exome', 'Infinium MethylationEPIC v2.0'.",RoP-Core-Omics-Platform,Kit|LibraryPrep|Chemistry,DataTecnica-derived,string,,Required-for-omics-data,06_omics.json
lncRNA-seq,lncRNA-seq,Long non-coding RNA measurements collected from RNA-Seq experiments,modules/Assay/Assay.yaml,enum_value:SequencingAssayEnum,,,,no_match,,,,,,,,,,
methylation array,methylation array,Methylation data captured by array technology,modules/Assay/Assay.yaml,enum_value:SequencingAssayEnum,,,,no_match,,,,,,,,,,
miRNA array,miRNA array,microRNA measurements captured by array technology,modules/Assay/Assay.yaml,enum_value:SequencingAssayEnum,,,,no_match,,,,,,,,,,
miRNA-seq,miRNA-seq,Small RNA measurements collected from RNA sequencing experiments,modules/Assay/Assay.yaml,enum_value:SequencingAssayEnum,,,,no_match,,,,,,,,,,
next-generation sequencing,next-generation sequencing,High-throughput DNA sequencing methods that allow massively parallel sequencing of millions of DNA fragments simultaneously.,modules/Assay/Assay.yaml,enum_value:SequencingAssayEnum,,NGS|next generation sequencing,,no_match,,,,,,,,,,
next generation targeted sequencing,next generation targeted sequencing,A type of next generation sequencing in which specific genes or portions of genes are targeted for sequencing using amplicon-based workflow.,modules/Assay/Assay.yaml,enum_value:SequencingAssayEnum,,Targeted NGS|Targeted NGS (sequencing of selected regions of the genome either via targeted capture or amplification)|Targeted Sequencing,,no_match,,,,,,,,,,
oxBS-seq,oxBS-seq,Oxidative bisulfite sequencing (oxBS-Seq) to map 5-methylcytosine and 5-hydroxymethylcytosine,modules/Assay/Assay.yaml,enum_value:SequencingAssayEnum,,,,no_match,,,,,,,,,,
ribo-seq,ribo-seq,Ribosome profiling (Ribo-Seq).,modules/Assay/Assay.yaml,enum_value:SequencingAssayEnum,,,,no_match,,,,,,,,,,
scCGI-seq,scCGI-seq,"A method for genome-wide CpG island (CGI) methylation sequencing for single cells (scCGI-seq), combining methylation-sensitive restriction enzyme digestion and multiple displacement amplification for selective detection of methylated CGIs",modules/Assay/Assay.yaml,enum_value:SequencingAssayEnum,,,,no_match,,,,,,,,,,
single cell ATAC-seq,single cell ATAC-seq,"A molecular genetic technique where DNA is isolated from single cell (sc) samples and amplified to create a genomic library. Then the library is subjected to ATAC-seq, which isolates and sequences regions rich in open chromatin.",modules/Assay/Assay.yaml,enum_value:SequencingAssayEnum,,scATAC-Seq,,no_match,,,,,,,,,,
single-cell RNA-seq,single-cell RNA-seq,A procedure that can determine the nucleotide sequence for all of the RNA transcripts in an amplified nucleotide sample that was derived from a single cell.,modules/Assay/Assay.yaml,enum_value:SequencingAssayEnum,,Single Cell RNA Sequencing|Single Cell Transcriptome Sequencing|scRNA-Seq,,no_match,,,,,,,,,,
single-nucleus RNA-seq,single-nucleus RNA-seq,"A method for quantifying the transcriptome of individual cells, in which transcripts isolated from single nuclei are subjected to high-throughput sequencing and mapping to a reference genome.",modules/Assay/Assay.yaml,enum_value:SequencingAssayEnum,,single-nucleus RNA sequencing assay|snRNA-Seq,,no_match,,,,,,,,,,
spatial transcriptomics,spatial transcriptomics,assay that allows visualization and quantitative analysis of the transcriptome with spatial resolution in individual tissue sections,modules/Assay/Assay.yaml,enum_value:SequencingAssayEnum,,,,no_match,,,,,,,,,,
targeted exome sequencing,targeted exome sequencing,"Also known as Clinical Exome Sequencing, Targeted Exome Sequencing is a subset of WES as it covers a limited number of genes, typically 3000 to 6000 genes.",modules/Assay/Assay.yaml,enum_value:SequencingAssayEnum,,,,no_match,,,,,,,,,,
whole exome sequencing,whole exome sequencing,A procedure that can determine the DNA sequence for all of the exons in an individual.,modules/Assay/Assay.yaml,enum_value:SequencingAssayEnum,,Exome|Exome Sequencing|WES|WXS,,no_match,,,,,,,,,,
whole genome sequencing,whole genome sequencing,Laboratory technique to sequence the complete DNA sequence of an organism's genome at a single time,modules/Assay/Assay.yaml,enum_value:SequencingAssayEnum,,Genome sequencing|WGS,,no_match,,,,,,,,,,
3D confocal imaging,3D confocal imaging,Confocal microscopy with 3D reconstruction of the sample tissue.,modules/Assay/Assay.yaml,enum_value:ImagingAssayEnum,,,1,name_fuzzy,68.2,ImagingBIDSConformance,"Brain Imaging Data Structure (BIDS) conformance level. BIDS is the de facto standard for organizing neuroimaging datasets and is required for many community pipelines (fMRIPrep, QSIPrep, MRIQC). Recording conformance level helps consumers know whether they can run BIDS-Apps directly or need a pre-processing step.",RoP-Core-Imaging,BIDSConformance,DataTecnica-derived,enum,BIDS-compliant|BIDS-partial|BIDS-derivatives|non-BIDS|unknown,Recommended-for-imaging-record,07_imaging_acquisition.json
3D confocal imaging,3D confocal imaging,Confocal microscopy with 3D reconstruction of the sample tissue.,modules/Assay/Assay.yaml,enum_value:ImagingAssayEnum,,,2,name_fuzzy,61.9,ImagingModality,"Imaging modality. Determines which other anchors apply: MRI brings field strength and sequence type; PET brings tracer and injected dose; CT brings tube voltage; OCT brings axial resolution; ultrasound brings transducer frequency. DICOM tag (0008,0060) maps directly here.",RoP-Core-Imaging,Modality|DICOMModality,DICOM,enum,MRI|fMRI|dMRI|MRS|PET|SPECT|CT|X-ray|ultrasound|OCT|fundus-photography|EEG|MEG|ECG|other,Required-for-imaging-record,07_imaging_acquisition.json
3D confocal imaging,3D confocal imaging,Confocal microscopy with 3D reconstruction of the sample tissue.,modules/Assay/Assay.yaml,enum_value:ImagingAssayEnum,,,3,name_fuzzy,60.4,ImagingQCStatus,"Quality control status from the cohort's QC pipeline. Records whether this scan passed automated and/or manual QC. JSON object {status, qc_pipeline, qc_pipeline_version, qc_notes, manual_review}. Common QC pipelines: MRIQC for structural MRI, FMRIPREP for fMRI, dMRIQC for diffusion. Allows downstream consumers to filter out low-quality scans without re-running QC.",RoP-Core-Imaging,QCStatus|QualityControlStatus,DataTecnica-derived,string,,Recommended-for-imaging-record,07_imaging_acquisition.json
3D electron microscopy,3D electron microscopy,"Three-dimensional (3D) reconstruction of single, transparent objects from a collection of projection images recorded with a transmission electron microscope. It offers the opportunity to obtain 3D information on structural cellular arrangements with a high resolution.",modules/Assay/Assay.yaml,enum_value:ImagingAssayEnum,,3D-EM|electron tomog,,no_match,,,,,,,,,,
3D imaging,3D imaging,"Technique to produce 3D images to visualize important structures in great detail. To produce 3D images, many scans are made, and then combined by computers to produce a 3D model, which can then be manipulated. 3D ultrasounds are produced using a somewhat similar technique.",modules/Assay/Assay.yaml,enum_value:ImagingAssayEnum,,"3-Dimensional Imaging|Medical Imaging, Three Dimensional|Three Dimensional Imaging",,no_match,,,,,,,,,,
CODEX,CODEX,CODEX imaging.,modules/Assay/Assay.yaml,enum_value:ImagingAssayEnum,,,,no_match,,,,,,,,,,
DNA optical mapping,DNA optical mapping,Fluorescent imaging of linearly extended DNA molecules to probe information patterns along the molecules,modules/Assay/Assay.yaml,enum_value:ImagingAssayEnum,,,,no_match,,,,,,,,,,
Fluorescence In Situ Hybridization,Fluorescence In Situ Hybridization,A physical mapping approach that uses fluorescent tags to detect hybridization of probes within metaphase chromosomes or less condensed somatic interphase chromatin.  This technique can be used for identification of chromosomal abnormalities and for gene mapping.,modules/Assay/Assay.yaml,enum_value:ImagingAssayEnum,,FISH,,no_match,,,,,,,,,,
Magnetization-Prepared Rapid Gradient Echo MRI,Magnetization-Prepared Rapid Gradient Echo MRI,"A magnetic resonance imaging modality that offers rapid imaging time, easy reconstruction of any plane, and three-dimensional surface contour rendering with cut away postprocessing.  Especially useful for imaging brain, MP-RAGE captures high tissue contrast and provides high spatial resolution with whole brain coverage in a short scan time.",modules/Assay/Assay.yaml,enum_value:ImagingAssayEnum,,MP RAGE|MP-RAGE MRI,,no_match,,,,,,,,,,
SUSHI,SUSHI,"Fast super-resolution method that exploits sparsity in the underlying vasculature and statistical independence within the measured signals to detect slow-flowing blood, facilitating noninvasive perfusion measurements.",modules/Assay/Assay.yaml,enum_value:ImagingAssayEnum,,,,no_match,,,,,,,,,,
atomic force microscopy,atomic force microscopy,Microscopy which uses a sharp spike (known as a 'tip') mounted on the end of a cantilever to scan the surface of the specimen,modules/Assay/Assay.yaml,enum_value:ImagingAssayEnum,,scanning force microscopy|AFM|atomic force imaging|SFM,,no_match,,,,,,,,,,
autoradiography,autoradiography,A radioactivity detection technique using X-ray film to visualize molecules or fragments of molecules that have been radioactively labeled.,modules/Assay/Assay.yaml,enum_value:ImagingAssayEnum,,,,no_match,,,,,,,,,,
brightfield microscopy,brightfield microscopy,Microscopy where the specimen is illuminated with light transmitted from a source on the opposite side of the specimen from the objective,modules/Assay/Assay.yaml,enum_value:ImagingAssayEnum,,bright-field optical microscopy|transmitted light microscopy,,no_match,,,,,,,,,,
live imaging,live imaging,"Imaging of live cells, tissues, or organisms over time to observe dynamic biological processes and behavior.",modules/Assay/Assay.yaml,enum_value:ImagingAssayEnum,,Live imaging,1,name_fuzzy,73.7,ImagingModality,"Imaging modality. Determines which other anchors apply: MRI brings field strength and sequence type; PET brings tracer and injected dose; CT brings tube voltage; OCT brings axial resolution; ultrasound brings transducer frequency. DICOM tag (0008,0060) maps directly here.",RoP-Core-Imaging,Modality|DICOMModality,DICOM,enum,MRI|fMRI|dMRI|MRS|PET|SPECT|CT|X-ray|ultrasound|OCT|fundus-photography|EEG|MEG|ECG|other,Required-for-imaging-record,07_imaging_acquisition.json
live imaging,live imaging,"Imaging of live cells, tissues, or organisms over time to observe dynamic biological processes and behavior.",modules/Assay/Assay.yaml,enum_value:ImagingAssayEnum,,Live imaging,2,name_fuzzy,73.7,ImagingScannerManufacturer,"Scanner manufacturer. DICOM tag (0008,0070). Critical for cross-cohort harmonization because Siemens / GE / Philips / Canon scanners produce systematically different intensity distributions even with nominally identical sequences. Multi-site studies typically include manufacturer as a covariate.",RoP-Core-Imaging,Manufacturer|DICOMManufacturer,DICOM,string,,Required-for-imaging-record,07_imaging_acquisition.json
live imaging,live imaging,"Imaging of live cells, tissues, or organisms over time to observe dynamic biological processes and behavior.",modules/Assay/Assay.yaml,enum_value:ImagingAssayEnum,,Live imaging,3,name_fuzzy,73.7,ImagingScannerModel,"Specific scanner model. DICOM tag (0008,1090). Examples: 'MAGNETOM Prisma' (Siemens 3T research scanner), 'SIGNA Premier' (GE 3T), 'Ingenia Elition' (Philips 3T), 'Discovery MI' (GE PET/CT). Distinct from manufacturer because batch effects often track model rather than vendor.",RoP-Core-Imaging,Model|DICOMManufacturerModelName,DICOM,string,,Required-for-imaging-record,07_imaging_acquisition.json
histology,histology,Microscopic examination of stained tissue sections to evaluate tissue architecture and cellular morphology.,modules/Assay/Assay.yaml,enum_value:ImagingAssayEnum,,,,no_match,,,,,,,,,,
confocal microscopy,confocal microscopy,"Confocal microscopy has advantages over widefield optical microscopy, including the ability to eliminate or reduce background information away from the focal plane and collect serial optical sections from thick specimens.  It uses point illumination and a spatial pinhole to eliminate out-of-focus light in specimens that are thicker than the focal plane.",modules/Assay/Assay.yaml,enum_value:ImagingAssayEnum,,,,no_match,,,,,,,,,,
conventional MRI,conventional MRI,"Magnetic resonance imaging using standard protocols for high resolution structural and anatomic characterization, including T1 weighted, T2 weighted, fluid attenuated inversion recovery (FLAIR), and gadolinium-enhanced sequences. [  NCI  ]",modules/Assay/Assay.yaml,enum_value:ImagingAssayEnum,,Conventional Magnetic Resonance Imaging,1,name_fuzzy,68.1,ImagingFieldStrength,"Static magnetic field strength in Tesla. DICOM tag (0018,0087). Required for MRI/fMRI/dMRI/MRS modalities; null otherwise. Cross-cohort meta-analysis typically stratifies by field strength because 1.5T, 3T, and 7T scanners produce systematically different SNR, contrast, and susceptibility artifacts.",RoP-Core-Imaging,FieldStrength|MagneticFieldStrength,DICOM,numeric,,Required-when-modality-MRI,07_imaging_acquisition.json
diffusion MRI,diffusion MRI,"MRI method that measure the diffusion of water in the tissue, rather than the content of water as measured in conventional MRI.",modules/Assay/Assay.yaml,enum_value:ImagingAssayEnum,,,,no_match,,,,,,,,,,
fluorescence microscopy assay,fluorescence microscopy assay,"Uses fluorescent labels to visualize and quantify specific cellular components, proteins, or biological processes under a fluorescence microscope by detecting the emitted light when the fluorophores are excited by specific wavelengths.",modules/Assay/Assay.yaml,enum_value:ImagingAssayEnum,,FM|fluorescence imaging|fluorescence microscopic imaging,,no_match,,,,,,,,,,
functional MRI,functional MRI,The principle of functional MRI imaging is to take a series of images of an organ in quick succession and to statistically analyze the images for differences among them. Most commonly used in studies of brain function. [  NCI  ],modules/Assay/Assay.yaml,enum_value:ImagingAssayEnum,,Functional Magnetic Resonance Imaging|fMRI,1,name_fuzzy,68.1,ImagingFieldStrength,"Static magnetic field strength in Tesla. DICOM tag (0018,0087). Required for MRI/fMRI/dMRI/MRS modalities; null otherwise. Cross-cohort meta-analysis typically stratifies by field strength because 1.5T, 3T, and 7T scanners produce systematically different SNR, contrast, and susceptibility artifacts.",RoP-Core-Imaging,FieldStrength|MagneticFieldStrength,DICOM,numeric,,Required-when-modality-MRI,07_imaging_acquisition.json
gel filtration chromatography,gel filtration chromatography,"'Gel filtration chromatography (synonym: gel permeation chromatography - GPC) is a type of size-exclusion chromatography (SEC), that separates analytes on the basis of size, typically in organic solvents.  The technique is often used for the analysis of polymers.'",modules/Assay/Assay.yaml,enum_value:ImagingAssayEnum,,gel-permeation chromatography|GPC,,no_match,,,,,,,,,,
high content screen,high content screen,An image analysis technique combining automated fluorescence microscopy with multi-parameter quantitative image analysis for the large scale study of cells (cellomics).,modules/Assay/Assay.yaml,enum_value:ImagingAssayEnum,,,1,name_fuzzy,60.5,ComponentLoadingsScope,"Whether the loadings are per-individual (suitable as covariates), per-feature (suitable for back-projection), or both. Critical because consumers need different file formats for different uses.",RoP-Core-ComponentLoadings,LoadingsScope,DataTecnica-derived,enum,per-individual|per-feature|both,Required-for-component-loadings-dataset,11_summary_stats.json
high frequency ultrasound,high frequency ultrasound,High frequency ultrasound (HFUS) is an imaging modality that can give greater resolution of surface changes in skin (review in PMID:24583666),modules/Assay/Assay.yaml,enum_value:ImagingAssayEnum,,,,no_match,,,,,,,,,,
immunocytochemistry,immunocytochemistry,The branch of immunochemistry dealing with cells and cellular activity; the application of immunochemical techniques to cytochemistry.,modules/Assay/Assay.yaml,enum_value:ImagingAssayEnum,,ICC,,no_match,,,,,,,,,,
immunofluorescence,immunofluorescence,An immunological procedure in which the antibodies are coupled with molecules which fluoresce under ultra violet (UV) light. This makes them particularly suitable for detection of specific antigens in tissues or on cells.,modules/Assay/Assay.yaml,enum_value:ImagingAssayEnum,,"FLUORESCENT IMMUNOASSAY|Fluorescent Antibody Assay|Fluorescent Antibody Procedure|Immunofluorescence Assay|Immunologic, Immunofluorescence",,no_match,,,,,,,,,,
immunohistochemistry,immunohistochemistry,An immunostaining assay to detect and potentially localize antigens within the cells of a tissue section,modules/Assay/Assay.yaml,enum_value:ImagingAssayEnum,,,,no_match,,,,,,,,,,
in vivo bioluminescence,in vivo bioluminescence,An imaging assay that allows detection of bioluminescence from a living organism or organisms.,modules/Assay/Assay.yaml,enum_value:ImagingAssayEnum,,,,no_match,,,,,,,,,,
laser speckle imaging,laser speckle imaging,"A noninvasive, non-scanning optical imaging technique that provides full-field visualization of blood flow to the tissue being imaged, which provides information about tissue perfusion and the efficiency of disease treatment.",modules/Assay/Assay.yaml,enum_value:ImagingAssayEnum,,LSCI|Laser Speckle Contrast Imaging,1,name_fuzzy,65.3,ImagingContrastAgent,"Contrast agent administered, when applicable. JSON object {agent_name, dose_mL, dose_mmol_per_kg, administration_route, timing_relative_to_scan_min}. Common in MRI (gadolinium-based: Gadovist, Dotarem, Magnevist) and CT (iodinated). Null for native-contrast scans.",RoP-Core-Imaging,ContrastAgent|GadoliniumAgent,DICOM,string,,Required-when-contrast-administered,07_imaging_acquisition.json
magnetic resonance angiography,magnetic resonance angiography,Angiography using magnetic resonance imaging.,modules/Assay/Assay.yaml,enum_value:ImagingAssayEnum,,MA|MR Angiography,,no_match,,,,,,,,,,
magnetic resonance spectroscopy,magnetic resonance spectroscopy,Detection and measurement of the resonant spectra of molecular species in a tissue or sample.,modules/Assay/Assay.yaml,enum_value:ImagingAssayEnum,,"NMR Spectroscopy|NUCLEAR MAGNETIC RESONANCE SPECTROSCOPY|Spectroscopy, MR|Spectroscopy, Nuclear Magnetic Resonance",,no_match,,,,,,,,,,
optical coherence tomography,optical coherence tomography,"Optical Coherence Tomography (OCT) combines the principles of ultrasound with the imaging performance of a microscope.  OCT uses infrared light waves that reflect off the internal microstructure within the biological tissues.  The frequencies and bandwidths of infrared light are orders of magnitude higher than medical ultrasound signals, resulting in greatly increased image resolution, 8-25 times greater than any existing modality.  In addition to providing high-level resolutions for the evaluation of microanatomic structures OCT is also able to provide information regarding tissue composition. OCT is most widely used in ophthalmology.",modules/Assay/Assay.yaml,enum_value:ImagingAssayEnum,,OCT,,no_match,,,,,,,,,,
optical tomography,optical tomography,"Optical tomography is a form of computed tomography that creates a digital volumetric model of an object by reconstructing images made from light transmitted and scattered through an object. Subtypes are diffuse optical tomography, time-of-flight diffuse optical tomography, fluorescence molecular tomography, confocal diffuse tomography, optical coherence tomography.",modules/Assay/Assay.yaml,enum_value:ImagingAssayEnum,,,,no_match,,,,,,,,,,
phase-contrast microscopy,phase-contrast microscopy,A simple non-quantitative form of interference microscopy of great utility in visualising live cells. Small differences in optical path length due to differences in refractive index and thickness of structures are visualised as differences in light intensity.,modules/Assay/Assay.yaml,enum_value:ImagingAssayEnum,,"Microscopy, Phase-Contrast",,no_match,,,,,,,,,,
photograph,photograph,An image recorded by a camera.,modules/Assay/Assay.yaml,enum_value:ImagingAssayEnum,,,,no_match,,,,,,,,,,
