name,title,description,source_file,term_type,range,aliases,match_rank,match_type,match_score,rop_item,rop_description,rop_collection,rop_alternate_names,rop_source_authority,rop_item_type,rop_values,rop_priority,rop_source_file
clinical,clinical,"Data containing clinical information, e.g. patient diagnosis, personal demographics, exposures, laboratory tests, family relationships.",modules/Data/Data.yaml,enum_value:Data,,Routine monitoring,2,name_fuzzy,62.5,ClinicalConceptSourceCode,"Source-vocabulary code as captured at the data origin. Examples: 'E11.9' (ICD-10-CM for type 2 diabetes), '250.00' (ICD-9-CM for the same), '2345-7' (LOINC for serum glucose), '6809' (RxNorm ingredient code for metformin), 'I26.9' (ICD-10 for unspecified pulmonary embolism). The source code is what was actually recorded; the standard code is OMOP's harmonized form.",RoP-Core-ClinicalConcepts,SourceCode|OriginalCode,DataTecnica-derived,string,,Required-for-clinical-concept-record,12_clinical_concepts.json
copy number variants,copy number variants,Copy number variants,modules/Data/Data.yaml,enum_value:Data,,,,no_match,,,,,,,,,,
count matrix,count matrix,"A table of unnormalized values representing summarised read counts per genomic region (e.g. gene, transcript, peak).",modules/Data/Data.yaml,enum_value:Data,,Read count matrix,,no_match,,,,,,,,,,
data index,data index,"A data index is information used to help with retrieval of some other data, especially large-scale data that would benefit from such an index. Very common formats are .bai and .tbi.",modules/Data/Data.yaml,enum_value:Data,,dataIndex,1,name_fuzzy,100.0,DataAssetIndexURI,"URI of the companion index file when applicable. VCF→TBI/CSI, BCF→CSI, BAM→BAI/CSI, CRAM→CRAI, GFF/GTF→TBI/CSI. Required for random access; without an index, downstream tools must fall back to full-file scans, which is prohibitive for cohort-scale data. Same URI scheme rules as DataAssetURI (DRS preferred).",RoP-Core-DataAssets,IndexURI|IndexFileLocation,DataTecnica-derived,string,,Required-when-data-asset-indexable,10_data_assets.json
data index,data index,"A data index is information used to help with retrieval of some other data, especially large-scale data that would benefit from such an index. Very common formats are .bai and .tbi.",modules/Data/Data.yaml,enum_value:Data,,dataIndex,2,name_fuzzy,66.7,VisitNumber,Sequential visit identifier within the study; 0 = baseline/screening visit.,RoP-Core-Time,VisitNum|VisitSeq|VisitIndex,DataTecnica-derived,numeric,0..200,Required-or-derivable,02_time.json
data sharing plan,data sharing plan,"A document containing the plan and documentation for data sharing, one component of overall data management.",modules/Data/Data.yaml,enum_value:Data,,DMP|Data Management Plan|Data Landscape Survey,,no_match,,,,,,,,,,
demographics,demographics,"The statistical characterization of human populations or segments of human populations (e.g., characterization by age, sex, race, or income).",modules/Data/Data.yaml,enum_value:Data,,Demographic Factor|Demography|Population Studies / Demography,,no_match,,,,,,,,,,
drug combination screen,drug combination screen,Information on drug sensitivity of more than one compound,modules/Data/Data.yaml,enum_value:Data,,drugCombinationScreen,,no_match,,,,,,,,,,
drug screen,drug screen,Information on drug sensitivity and molecular markers of drug response,modules/Data/Data.yaml,enum_value:Data,,drugScreen,,no_match,,,,,,,,,,
electrophysiology,electrophysiology,"Data generated from an electrophysiology assay, e.g: 
- Cell: Resting membrane potential, ion channel currents (patch clamp data)
- Neurons: Action potentials, resting potential, synaptic potentials. 
- Heart: Electrocardiogram (ECG/EKG) waveforms, cardiac action potentials.
- Muscle: Electromyogram (EMG) signals
- Whole brain: Electroencephalogram (EEG)
- Retina: Electroretinogram (ERG)",modules/Data/Data.yaml,enum_value:Data,,,,no_match,,,,,,,,,,
epidemiological data,epidemiological data,Data that is used to describe the distribution of a disease or health-related characteristic within a population and to identify factors that affect that distribution.,modules/Data/Data.yaml,enum_value:Data,,,,no_match,,,,,,,,,,
gene expression,gene expression,"Data of the levels and patterns of synthesis of gene products (proteins and functional RNA), including interpretation in functional terms of gene expression data.",modules/Data/Data.yaml,enum_value:Data,,geneExpression|expression data,,no_match,,,,,,,,,,
gene expression matrix,gene expression matrix,The final processed (normalised) data for a set of hybridisations in a microarray experiment. This combines data from all hybridisations.,modules/Data/Data.yaml,enum_value:Data,,Gene expression data matrix|Normalised microarray data,,no_match,,,,,,,,,,
quantified gene expression,quantified gene expression,"Expression measurements that have been summarized or normalized, typically representing quantified abundance metrics rather than raw instrument output.",modules/Data/Data.yaml,enum_value:Data,,,,no_match,,,,,,,,,,
genomic features,genomic features,Data of sequence feature (continuous extent of biological sequence) that is of genomic origin.,modules/Data/Data.yaml,enum_value:Data,,genomicFeatures,1,name_fuzzy,66.7,ComponentLoadingsInputFeatures,"Description of the input features the dimensionality reduction was computed over. Free text but should be specific. Examples: 'GP2 release 7 imputed genotypes, MAF>0.01, LD-pruned r2<0.1', 'log-CPM gene expression after batch correction', '~10K CpG sites passing QC'. Critical for consumers deciding whether the loadings are appropriate for their use case.",RoP-Core-ComponentLoadings,InputFeatureSet,DataTecnica-derived,string,,Required-for-component-loadings-dataset,11_summary_stats.json
genomic features,genomic features,Data of sequence feature (continuous extent of biological sequence) that is of genomic origin.,modules/Data/Data.yaml,enum_value:Data,,genomicFeatures,2,name_fuzzy,60.9,SummaryStatsGenomicReference,Reference assembly used for variant coordinates in summary statistics. Critical because GRCh37 and GRCh38 coordinates are not interchangeable; downstream meta-analysis requires liftover when mixing assemblies. Mirrors Tier 5 ReferenceAssembly but at the summary-stats granularity.,RoP-Core-SummaryStats,VariantReferenceAssembly,DataTecnica-derived,enum,GRCh38|GRCh37|T2T-CHM13|hg38|hg19|NotApplicable,Required-when-variant-level-summary-stats,11_summary_stats.json
genomic features,genomic features,Data of sequence feature (continuous extent of biological sequence) that is of genomic origin.,modules/Data/Data.yaml,enum_value:Data,,genomicFeatures,3,name_fuzzy,60.9,SummaryStatsLambdaGC,"Genomic inflation factor (lambda GC) for the summary statistics, when applicable. Diagnostic for population stratification and confounding. Values >1.10 typically indicate residual stratification needing correction.",RoP-Core-SummaryStats,LambdaGC|GenomicInflation,DataTecnica-derived,numeric,,Recommended-for-variant-level-summary-stats,11_summary_stats.json
genomic variants,genomic variants,"Genomic alterations, including single nucleotide polymorphisms, short indels and structural variants. Use more specific term if possible, esp. if data is only of one specific subset.",modules/Data/Data.yaml,enum_value:Data,,Gene sequence variations|genomicVariants,,no_match,,,,,,,,,,
germline variants,germline variants,Called germline variants,modules/Data/Data.yaml,enum_value:Data,,GermlineVariants,,no_match,,,,,,,,,,
guide RNA sequence,guide RNA sequence,Sequence data for guide RNAs used in CRISPR or other gene editing experiments.,modules/Data/Data.yaml,enum_value:Data,,sgRNA sequence|gRNA sequence,,no_match,,,,,,,,,,
image,image,Biological or biomedical data that has been rendered into an image.,modules/Data/Data.yaml,enum_value:Data,,Image data|jpg|immunofluorescence,,no_match,,,,,,,,,,
immunoassay,immunoassay,Laboratory test involving interaction of antigens with specific antibodies.,modules/Data/Data.yaml,enum_value:Data,,Immunological Laboratory Method|Immunology Test,,no_match,,,,,,,,,,
isoform expression,isoform expression,Expression of protein isoforms formed from alternative splicings or other post-translational modifications of a single gene through RNA splicing mechanisms.,modules/Data/Data.yaml,enum_value:Data,,Isoform Measurement|Isoform Quantitation|Protein Isoform Measurement|Protein Isoform Quantitation|isoformExpression,,no_match,,,,,,,,,,
kinomics,kinomics,Data studying protein kinase signaling/activity.,modules/Data/Data.yaml,enum_value:Data,,,,no_match,,,,,,,,,,
mask image,mask image,"Image used as the mask for an image processing operation, such as subtraction.",modules/Data/Data.yaml,enum_value:Data,,,1,name_fuzzy,66.7,PipelineSourceCommit,Specific commit SHA (full 40-character preferred) or container image digest pinning the exact code state used. Required for reproducibility whenever PipelineSourceRepository is set. Example: '7a3b2c1d4e5f6a7b8c9d0e1f2a3b4c5d6e7f8a9b' or 'sha256:e3b0c44298fc1c149afbf4c8996fb92427ae41e4649b934ca495991b7852b855'.,RoP-Core-Omics-Platform,CommitSHA|CommitHash|ImageDigest,DataTecnica-derived,string,,Required-when-PipelineSourceRepository-present,06_omics.json
mask image,mask image,"Image used as the mask for an image processing operation, such as subtraction.",modules/Data/Data.yaml,enum_value:Data,,,2,name_fuzzy,66.7,PipelineContainerImage,"Container image and tag identifying the runtime environment in which the pipeline executed, when applicable. Captures the dependency closure that PipelineSourceCommit alone cannot: the same code may run differently against different system libraries. Examples: 'nfcore/rnaseq:3.10.1', 'broadinstitute/gatk:4.4.0.0', 'us-docker.pkg.dev/dragen/dragen:4.2.4'.",RoP-Core-Omics-Platform,ContainerImage|DockerImage|OCIImage,DataTecnica-derived,string,,Recommended-for-omics-data,06_omics.json
mass spectrometry data,mass spectrometry data,Data from mass spectrometry measurement.,modules/Data/Data.yaml,enum_value:Data,,,1,name_fuzzy,62.5,DataAssetSampleScope,"Whether this asset contains data for one or many individuals/biosamples. Determines downstream subsetting, demultiplexing, and join logic. A single-sample VCF and a joint-called multi-sample VCF have identical format but require very different processing.",RoP-Core-DataAssets,AssetScope|ScopeOfAsset,DataTecnica-derived,enum,per-individual|per-biosample|per-cohort|per-batch|per-tissue-block|aggregate-derived|other,Required-when-DataAssetURI-present,10_data_assets.json
mass spectrometry data,mass spectrometry data,Data from mass spectrometry measurement.,modules/Data/Data.yaml,enum_value:Data,,,2,name_fuzzy,61.9,DataAssetType,"Category of data asset. Determines which downstream tools are appropriate for retrieval, indexing, and analysis. Intentionally broad to cover omics (VCF/BAM/CRAM/FASTQ/counts/h5ad), imaging (DICOM/NIfTI/TIFF), proteomics (mzML/MGF), and tabular formats (Parquet/HDF5/Zarr/CSV/TSV).",RoP-Core-DataAssets,AssetType|FileType,DataTecnica-derived,enum,VCF|gVCF|BCF|BAM|CRAM|SAM|FASTQ|counts-matrix|proteomics-matrix|methylation-matrix|expression-matrix|h5ad|loom|MatrixMarket|Parquet|HDF5|Zarr|DICOM|NIfTI|TIFF|MGF|mzML|imzML|GFF|GTF|BED|PDF|TSV|CSV|JSON|other,Required-when-data-asset-present,10_data_assets.json
metabolomics,metabolomics,"Data of metabolites, the chemical processes they are involved, and the chemical fingerprints of specific cellular processes in a whole cell, tissue, organ or organism.",modules/Data/Data.yaml,enum_value:Data,,,,no_match,,,,,,,,,,
molecular property,molecular property,"Data on the physical (e.g. structural) or chemical properties of molecules, or parts of a molecule.",modules/Data/Data.yaml,enum_value:Data,,Physicochemical property,,no_match,,,,,,,,,,
morphology parameter,morphology parameter,"Experimentally determined parameter of the morphology of an organism, e.g. size & shape. General term representing data about **structure** and **form** of an organism or organism part.",modules/Data/Data.yaml,enum_value:Data,,,1,name_fuzzy,62.1,PipelineConfigReference,"Pointer to the configuration or parameter set used for this pipeline run. DOI, URL, content hash, or relative path within PipelineSourceRepository. Captures the difference between two runs of the same code with different parameters — without this, two valid runs of the same pipeline producing different results are indistinguishable. Examples: 'configs/grch38_default.yaml', '10.5281/zenodo.12345', 'sha256:abc123...'.",RoP-Core-Omics-Platform,PipelineParams|ConfigHash|ParameterSet,DataTecnica-derived,string,,Recommended-for-omics-data,06_omics.json
network,network,Network data represents connections between entities and are often in graphical format.,modules/Data/Data.yaml,enum_value:Data,,Pathway,,no_match,,,,,,,,,,
nucleic acid sequence record,nucleic acid sequence record,A nucleic acid sequence and associated metadata.,modules/Data/Data.yaml,enum_value:Data,,Nucleotide sequence record|Sequence record (nucleic acid),,no_match,,,,,,,,,,
over-representation data,over-representation data,"A ranked list of categories (usually ontology concepts), each associated with a statistical metric of over-/under-representation within the studied data.",modules/Data/Data.yaml,enum_value:Data,,Enrichment report|Over-representation report,,no_match,,,,,,,,,,
particle characterization,particle characterization,"Data providing information about entities such as composition, structure and defects.",modules/Data/Data.yaml,enum_value:Data,,,,no_match,,,,,,,,,,
pharmacokinetics,pharmacokinetics,"Data characterizing the process by which a drug is absorbed, distributed, metabolized, and eliminated by the body.",modules/Data/Data.yaml,enum_value:Data,,PK Study|Pharmacokinetic Study,,no_match,,,,,,,,,,
physiology parameter,physiology parameter,"Experimentally determined parameter of the physiology of an organism, e.g. metabolic rate. General term representing data about **function** and **process** of an organism or organism part.",modules/Data/Data.yaml,enum_value:Data,,,1,name_fuzzy,62.1,PipelineConfigReference,"Pointer to the configuration or parameter set used for this pipeline run. DOI, URL, content hash, or relative path within PipelineSourceRepository. Captures the difference between two runs of the same code with different parameters — without this, two valid runs of the same pipeline producing different results are indistinguishable. Examples: 'configs/grch38_default.yaml', '10.5281/zenodo.12345', 'sha256:abc123...'.",RoP-Core-Omics-Platform,PipelineParams|ConfigHash|ParameterSet,DataTecnica-derived,string,,Recommended-for-omics-data,06_omics.json
plasmid sequence,plasmid sequence,Sequence data for plasmid vectors used in cloning or gene expression experiments.,modules/Data/Data.yaml,enum_value:Data,,,1,name_fuzzy,66.7,ImagingSequenceType,"Pulse sequence or acquisition type. For MRI: T1w, T2w, FLAIR, DWI, DTI, fMRI-BOLD, ASL, MRS, SWI, MP-RAGE, MP2RAGE. For PET: dynamic vs static. For CT: contrast-enhanced vs non-contrast. Free text because the sequence taxonomy is broad and evolves.",RoP-Core-Imaging,SequenceType|PulseSequence,DataTecnica-derived,string,,Required-for-imaging-record,07_imaging_acquisition.json
plot,plot,"Data that has been plotted as a graph of some type, or data representing such a graph.",modules/Data/Data.yaml,enum_value:Data,,Graph data,,no_match,,,,,,,,,,
primer sequence,primer sequence,Sequence data for oligonucleotide primers used in PCR or sequencing experiments.,modules/Data/Data.yaml,enum_value:Data,,,1,name_fuzzy,69.6,ImagingSequenceType,"Pulse sequence or acquisition type. For MRI: T1w, T2w, FLAIR, DWI, DTI, fMRI-BOLD, ASL, MRS, SWI, MP-RAGE, MP2RAGE. For PET: dynamic vs static. For CT: contrast-enhanced vs non-contrast. Free text because the sequence taxonomy is broad and evolves.",RoP-Core-Imaging,SequenceType|PulseSequence,DataTecnica-derived,string,,Required-for-imaging-record,07_imaging_acquisition.json
probe sequence,probe sequence,Sequence data for nucleic acid probes used in hybridization experiments.,modules/Data/Data.yaml,enum_value:Data,,,1,name_fuzzy,72.7,ImagingSequenceType,"Pulse sequence or acquisition type. For MRI: T1w, T2w, FLAIR, DWI, DTI, fMRI-BOLD, ASL, MRS, SWI, MP-RAGE, MP2RAGE. For PET: dynamic vs static. For CT: contrast-enhanced vs non-contrast. Free text because the sequence taxonomy is broad and evolves.",RoP-Core-Imaging,SequenceType|PulseSequence,DataTecnica-derived,string,,Required-for-imaging-record,07_imaging_acquisition.json
promoter sequence,promoter sequence,"Sequence data of promoter region (P0, flCAG, etc.)",modules/Data/Data.yaml,enum_value:Data,,,1,name_fuzzy,64.0,ImagingSequenceType,"Pulse sequence or acquisition type. For MRI: T1w, T2w, FLAIR, DWI, DTI, fMRI-BOLD, ASL, MRS, SWI, MP-RAGE, MP2RAGE. For PET: dynamic vs static. For CT: contrast-enhanced vs non-contrast. Free text because the sequence taxonomy is broad and evolves.",RoP-Core-Imaging,SequenceType|PulseSequence,DataTecnica-derived,string,,Required-for-imaging-record,07_imaging_acquisition.json
protein interaction data,protein interaction data,"Data concerning the interactions (predicted or known) within or between a protein, structural domain or part of a protein.  This includes intra- and inter-residue contacts and distances, as well as interactions with other proteins and non-protein entities such as nucleic acid, metal atoms, water, ions etc.",modules/Data/Data.yaml,enum_value:Data,,Protein interaction record|Protein report (interaction)|Protein-protein interaction data,,no_match,,,,,,,,,,
protein interaction raw data,protein interaction raw data,"Protein-protein interaction data from for example yeast two-hybrid analysis, protein microarrays, immunoaffinity chromatography followed by mass spectrometry, phage display etc.",modules/Data/Data.yaml,enum_value:Data,,,,no_match,,,,,,,,,,
proteomics,proteomics,"Protein and peptide identification, especially in the study of whole proteomes of organisms.",modules/Data/Data.yaml,enum_value:Data,,,,no_match,,,,,,,,,,
raw counts,raw counts,The number or amount of something.,modules/Data/Data.yaml,enum_value:Data,,Count|NUMBER|Num|Number Count,1,name_fuzzy,66.7,CollectionMemberCount,"Snapshot of how many CDE rows belong to this collection. JSON object {total, by_module, by_source_authority, snapshot_date}. Enables size-based prioritization in the UI and tracks growth over time. Computed at bundle build time, not maintained by hand.",RoP-Core-Collections,MemberCount|RowCount,DataTecnica-derived,string,,Recommended-for-collection-record,13b_collections.json
reference sequence,reference sequence,Generic sequence data used as a reference in experimental design or analysis.,modules/Data/Data.yaml,enum_value:Data,,,1,name_fuzzy,66.7,AncestryGeneticReferencePanel,Reference panel used as the basis for genetic ancestry estimation. Required when any AncestryGenetic* field is populated.,RoP-Core-AncestryPedigree,AncestryReferencePanel|RefPanel,DataTecnica-derived,enum,1KG-phase3|TOPMed-Bravo|HGDP|gnomAD-v3|GP2-internal|Other,Required-when-genetic-ancestry-present,04_ancestry_pedigree.json
reference sequence,reference sequence,Generic sequence data used as a reference in experimental design or analysis.,modules/Data/Data.yaml,enum_value:Data,,,2,name_fuzzy,66.7,ExternalBiosampleIDs,"Array of {authority, identifier} pairs for the same physical specimen tracked under different IDs in external systems (biobanks, sequencing centers, GenBank/SRA accessions, consortium-level IDs).",RoP-Core-Biosample,AlternateSampleIDs|CrossReferenceIDs,DataTecnica-derived,string,,Optional,05_biosample.json
reference sequence,reference sequence,Generic sequence data used as a reference in experimental design or analysis.,modules/Data/Data.yaml,enum_value:Data,,,3,name_fuzzy,66.7,ReferenceAssembly,"Reference assembly or panel used for genomic data alignment, variant calling, or quantification. Required when AssayAnalyteCode points to genomic content.",RoP-Core-Omics-Platform,ReferenceGenome|GenomeBuild,DataTecnica-derived,enum,GRCh38|GRCh37|T2T-CHM13|hg38|hg19|mm10|mm39|GRCm39|Other|NotApplicable,Required-when-genomic,06_omics.json
report,report,"A human-readable collection of information including annotation on a biological entity or phenomena, computer-generated reports of analysis of primary data... as distinct from the primary data itself.",modules/Data/Data.yaml,enum_value:Data,,Document|Record|analysis,,no_match,,,,,,,,,,
somatic variants,somatic variants,Called somatic variants,modules/Data/Data.yaml,enum_value:Data,,SomaticVariants,,no_match,,,,,,,,,,
structural variants,structural variants,"Genomic variants data that covers deletions, duplications, CNVs, insertions, inversions, and translocations, which may be derived from specialized variant calling workflows.",modules/Data/Data.yaml,enum_value:Data,,,,no_match,,,,,,,,,,
survey data,survey data,A data set that contains the outcome of a survey.,modules/Data/Data.yaml,enum_value:Data,,surveyData,,no_match,,,,,,,,,,
text data,text data,"Data that is represented as text, usually referring to ""unstructured data"".",modules/Data/Data.yaml,enum_value:Data,,space-delimited text,,no_match,,,,,,,,,,
volume,volume,Data of the three dimensional space occupied by an entity or the capacity of a space or container.,modules/Data/Data.yaml,enum_value:Data,,Total Volume|Vol|Volume,1,exact,100.0,AliquotVolumeUL,Aliquot volume in microliters. Null for solid tissue specimens or when not applicable.,RoP-Core-Biosample,Volume|VolumeUL,DataTecnica-derived,numeric,0.0..1000000.0,Optional,05_biosample.json
weight,weight,The vertical force exerted by a mass as a result of gravity.,modules/Data/Data.yaml,enum_value:Data,,Weight,,no_match,,,,,,,,,,
derived,derived,Data from additional analytical steps performed on already processed data.,modules/Data/Data.yaml,enum_value:DataSubtypeEnum,,,1,name_fuzzy,100.0,ComponentLoadingsDerivedFrom,"Identifier of the dataset from which the loadings were computed, when distinct from the cohort declaring this row. Important for re-use scenarios: GP2 PCA loadings computed on the GP2 reference set may be projected onto a new cohort, in which case the new cohort references the GP2 dataset as the source of the loadings.",RoP-Core-ComponentLoadings,LoadingsSourceDataset,DataTecnica-derived,string,,Required-when-projected-loadings,11_summary_stats.json
derived,derived,Data from additional analytical steps performed on already processed data.,modules/Data/Data.yaml,enum_value:DataSubtypeEnum,,,2,name_fuzzy,100.0,ResourceLinkedSummaryStats,Tier 9 summary statistics datasets produced by analyses on this resource's data. JSON array of SummaryStatsResultsURI references. Enables traversal from resource → derived analyses for downstream meta-analysis discovery.,RoP-Core-Resource,DerivedSummaryStats,DataTecnica-derived,string,,Optional,13a_resources.json
derived,derived,Data from additional analytical steps performed on already processed data.,modules/Data/Data.yaml,enum_value:DataSubtypeEnum,,,3,name_fuzzy,100.0,CollectionParentCollections,"When this collection is derived from or extends another collection, the parent CollectionID values. JSON array. Example: Path-ND-Genetic-Subset is derived from Path-ND. Enables provenance traversal and avoids duplicating shared content.",RoP-Core-Collections,ParentCollections|DerivedFrom,DataTecnica-derived,string,,Required-when-derived-collection,13b_collections.json
normalized,normalized,Data that has undergone a normalization procedure to adjust for technical variation or to bring measurements onto a common scale. Considered a more specific type of processed data.,modules/Data/Data.yaml,enum_value:DataSubtypeEnum,,,,no_match,,,,,,,,,,
processed,processed,Data generated from running one or more bioinformatics methods on raw data.,modules/Data/Data.yaml,enum_value:DataSubtypeEnum,,,,no_match,,,,,,,,,,
quantified,quantified,"Data representing measurements/counts of specific features (gene counts, peak intensities, object properties).",modules/Data/Data.yaml,enum_value:DataSubtypeEnum,,,,no_match,,,,,,,,,,
raw,raw,Data produced by experimental measurement/observation with very little subsequent processing.,modules/Data/Data.yaml,enum_value:DataSubtypeEnum,,,,no_match,,,,,,,,,,
synthetic,synthetic,"Data generated computationally via models or simulations, not direct experimental measurement.",modules/Data/Data.yaml,enum_value:DataSubtypeEnum,,,,no_match,,,,,,,,,,
descriptive metadata,descriptive metadata,"Information that describes and identifies a resource, including elements that facilitate discovery and understanding.",modules/Data/Data.yaml,enum_value:MetadataEnum,,,,no_match,,,,,,,,,,
image metadata,image metadata,Data concerning a specific biological or biomedical image.,modules/Data/Data.yaml,enum_value:MetadataEnum,,Image-associated data|Image-related data,,no_match,,,,,,,,,,
metadata,metadata,Most general label for data that contains information about data.,modules/Data/Data.yaml,enum_value:MetadataEnum,,,1,name_fuzzy,100.0,ResourceCellLineMetadata,"When the resource is a cell-line catalog (analogous to iNDI), structured metadata about the cell-line collection. JSON object with parental_line, genome_assembly, distribution_route, and per-line counts. Captures the iNDI-style 'mostly-constant fields' (KOLF2.1J parental, GRCh38, JAX distribution) without forcing them into per-row anchors.",RoP-Core-Resource,CellLineCollectionMetadata,DataTecnica-derived,string,,Required-when-cell-line-resource,13a_resources.json
