Attribute,Description,Valid Values,DependsOn,Required,Source,Parent,Properties,DependsOn Component,Validation Rules,.ID,.Type,.Module,.Root,.SubOf,.Range,.Cardinality,.EditorNote
Neurofibromatosis type 1,"(NF1) - A disease characterized by patches of skin pigmentation (cafe-au-lait spots), Lisch nodules of the iris, tumors in the peripheral nervous system and fibromatous skin tumors. Individuals with the disorder have increased susceptibility to the development of benign and malignant tumors.","","",FALSE,"",diagnosis,,"","",Neurofibromatosis_Type_1,Class,Biosample,Diagnosis,"","","",""
Neurofibromatosis type 2,"(NF2) - Genetic disorder characterized by bilateral vestibular schwannomas (formerly called acoustic neuromas), schwannomas of other cranial and peripheral nerves, meningiomas, and ependymomas. It is inherited in an autosomal dominant fashion with full penetrance.","","",FALSE,https://www.ebi.ac.uk/ols/ontologies/cco/terms?iri=http%3A%2F%2Fidentifiers.org%2Fomim%2F101000,diagnosis,,"","",Neurofibromatosis_Type_2,Class,Biosample,Diagnosis,"","","",""
Schwannomatosis,A rare genetic disorder characterized by the presence of multiple schwannomas.,"","",FALSE,https://www.ebi.ac.uk/ols/ontologies/ncit/terms?iri=http%3A%2F%2Fpurl.obolibrary.org%2Fobo%2FNCIT_C6557,diagnosis,,"","",Schwannomatosis,Class,Biosample,Diagnosis,"","","",""
Not Applicable,"An NF diagnosis (e.g. NF1, NF2, or Schwannomatosis) does not apply here.","","",FALSE,"",diagnosis,,"","",Not_Applicable,Class,Biosample,Diagnosis,"","","",""
Sporadic Schwannoma,A,"","",,"",diagnosis,,"","",Sporadic_Schwannoma,Class,Biosample,Diagnosis,"","","",""
